{
  "account_id": "ACC_003",
  "company_name": "ABC Plumbing Services",
  "business_hours": {
    "days": [
      "Monday",
      "Tuesday",
      "Wednesday",
      "Thursday",
      "Friday"
    ],
    "start_time": "08:00",
    "end_time": "18:00",
    "timezone": "EST"
  },
  "office_address": "789 River Road, Springfield, IL 62701",
  "services_supported": [
    "Plumbing",
    "Drain Cleaning",
    "Water Heater Installation",
    "Emergency Plumbing",
    "Sump Pump Installation"
  ],
  "emergency_definition": [
    "burst pipes",
    "major leaks",
    "sewage backups",
    "no hot water in winter"
  ],
  "emergency_routing_rules": {
    "primary_contact": "555-020125",
    "secondary_contacts": [
      "555-020126"
    ],
    "fallback_protocol": "immediate transfer to primary contact, callback within 20 minutes if fails"
  },
  "non_emergency_routing_rules": {
    "primary_contact": "555-020124",
    "secondary_contacts": [],
    "message_protocol": "We take messages after hours and call back first thing in the morning"
  },
  "call_transfer_rules": {
    "timeout_seconds": 30,
    "max_retries": 3,
    "failure_message": "I'm unable to connect you right now, but I'll make sure someone gets your message and calls you back as soon as possible."
  },
  "integration_constraints": [
    "Never schedule drain cleaning jobs between 08:00 and 09:00",
    "Never promise a specific arrival time, always give a 2-hour window"
  ],
  "after_hours_flow_summary": "emergencies get immediate transfer to primary contact, non-emergencies get message taken and callback confirmed for next business morning before 10 AM",
  "office_hours_flow_summary": "drain cleaning jobs not scheduled between 08:00 and 09:00, 2-hour arrival window given",
  "questions_or_unknowns": [
    "No secondary emergency contact provided",
    "No fallback protocol for emergency contact provided",
    "No failure message for call transfer provided"
  ],
  "notes": "Extracted from demo call transcript for ABC Plumbing Services",
  "version": "v2",
  "last_updated": "2026-03-05T00:11:37.541822"
}