{
  "account_id": "ACC_005",
  "company_name": "CleanAir HVAC Services",
  "business_hours": {
    "days": [
      "Monday",
      "Tuesday",
      "Wednesday",
      "Thursday",
      "Friday",
      "Saturday"
    ],
    "start_time": "08:00",
    "end_time": "20:00",
    "timezone": "MST"
  },
  "office_address": "321 Comfort Lane, Denver, CO 80201",
  "services_supported": [
    "Heating Repair",
    "AC Installation",
    "Air Quality Testing",
    "Duct Cleaning",
    "Furnace Maintenance",
    "Smart Thermostat Installation",
    "Heat Pump Service"
  ],
  "emergency_definition": [
    "no heat in winter when below freezing",
    "no cooling during heat advisory",
    "gas smell near the HVAC unit",
    "carbon monoxide alerts",
    "gas smell near HVAC",
    "No cooling when outdoor temperature is above 95 degrees"
  ],
  "emergency_routing_rules": {
    "primary_contact": "555-040125",
    "secondary_contacts": [
      "555-040126"
    ],
    "fallback_protocol": "promise callback within 1 hour"
  },
  "non_emergency_routing_rules": {
    "primary_contact": "555-040124",
    "secondary_contacts": [],
    "message_protocol": "call back within 1 hour during business hours"
  },
  "call_transfer_rules": {
    "timeout_seconds": 30,
    "max_retries": 3,
    "failure_message": "I'm unable to connect you right now, but I'll make sure someone gets your message and calls you back as soon as possible."
  },
  "integration_constraints": [
    "never perform work on a system under warranty from another contractor without written authorization",
    "Never schedule maintenance visits on the same day the customer calls",
    "minimum next-day scheduling",
    "Never dispatch for warranty work without first verifying warranty status with the customer"
  ],
  "after_hours_flow_summary": "emergency transfer: attempt primary then secondary, promise callback within 1 hour",
  "office_hours_flow_summary": "call back within 1 hour during business hours for regular service and maintenance scheduling",
  "questions_or_unknowns": [
    "Account ID not provided",
    "Failure message for call transfer not specified",
    "Fallback protocol for emergency routing not specified"
  ],
  "notes": "Extracted from demo call transcript",
  "version": "v2",
  "last_updated": "2026-03-05T01:02:04.335247"
}