{
  "account_id": "ACC_002",
  "company_name": "TechRepair Solutions",
  "business_hours": {
    "days": [
      "Monday",
      "Tuesday",
      "Wednesday",
      "Thursday",
      "Friday",
      "Saturday"
    ],
    "start_time": "09:00",
    "end_time": "19:00",
    "timezone": "PST"
  },
  "office_address": "123 Main Street, Anytown, CA 90210",
  "services_supported": [
    "Computer Repair",
    "IT Support",
    "Network Setup"
  ],
  "emergency_definition": [
    "server downtime",
    "critical data loss",
    "complete network outages"
  ],
  "emergency_routing_rules": {
    "primary_contact": "555-010223",
    "secondary_contacts": [],
    "fallback_protocol": "messages are taken and callbacks are made within 2 hours"
  },
  "non_emergency_routing_rules": {
    "primary_contact": "555-010224",
    "secondary_contacts": [],
    "message_protocol": "messages are taken and followed up next business day"
  },
  "call_transfer_rules": {
    "timeout_seconds": 30,
    "max_retries": 3,
    "failure_message": "I'm unable to connect you right now, but I'll make sure someone gets your message and calls you back as soon as possible."
  },
  "integration_constraints": [],
  "after_hours_flow_summary": "screens for emergencies, non-emergency calls get a message and follow-up next business day",
  "office_hours_flow_summary": "calls are answered, messages are taken if no answer and callbacks are made within 2 hours",
  "questions_or_unknowns": [
    "Account ID not provided",
    "Call transfer rules not mentioned",
    "Failure message for call transfer not specified",
    "Integration constraints not mentioned"
  ],
  "notes": "Extracted account information from demo call transcript",
  "version": "v1",
  "last_updated": "2026-03-05T01:01:55.128409"
}