{
  "account_id": "ACC_001",
  "company_name": "Ben's Electric Solutions",
  "business_hours": {
    "days": [
      "Monday",
      "Tuesday",
      "Wednesday",
      "Thursday",
      "Friday"
    ],
    "start_time": "07:00",
    "end_time": "17:00",
    "timezone": "MST"
  },
  "office_address": "4710 17 Ave SW, Calgary, AB T3E 0E4",
  "services_supported": [
    "residential service calls",
    "commercial projects",
    "panel upgrades",
    "new installations",
    "EV charger setup"
  ],
  "emergency_definition": [
    "complete power outages affecting the whole property",
    "sparking or burning electrical panels",
    "electrical fires or smoke from outlets",
    "downed power lines on property"
  ],
  "emergency_routing_rules": {
    "primary_contact": "403-870-8494",
    "secondary_contacts": [],
    "fallback_protocol": "connect to Ben directly"
  },
  "non_emergency_routing_rules": {
    "primary_contact": "403-870-8494",
    "secondary_contacts": [],
    "message_protocol": "call back within 2 hours if nobody answers"
  },
  "call_transfer_rules": {
    "timeout_seconds": 30,
    "max_retries": 3,
    "failure_message": "I'm unable to connect you right now, but I'll make sure someone gets your message and calls you back as soon as possible."
  },
  "integration_constraints": [
    "do not schedule jobs without customer confirmation",
    "do not take on jobs outside Calgary and surrounding areas within 50 kilometers"
  ],
  "after_hours_flow_summary": "screen for true emergencies first, connect to Ben directly for emergencies, take a message for non-emergencies",
  "office_hours_flow_summary": "call 403-870-8494, call back within 2 hours if nobody answers",
  "questions_or_unknowns": [
    "Account ID not provided",
    "Failure message for call transfer not specified"
  ],
  "notes": "Extracted from demo call transcript",
  "version": "v1",
  "last_updated": "2026-03-05T00:11:30.206448"
}