{
  "account_id": "ACC_002",
  "company_name": "TechRepair Solutions",
  "business_hours": {
    "days": [
      "Monday",
      "Tuesday",
      "Wednesday",
      "Thursday",
      "Friday",
      "Saturday"
    ],
    "start_time": "09:00",
    "end_time": "19:00",
    "timezone": "PST"
  },
  "office_address": "456 Oak Avenue, Anytown, CA 90210",
  "services_supported": [
    "Computer Repair",
    "IT Support",
    "Network Setup services to residential",
    "small business customers"
  ],
  "emergency_definition": [
    "server downtime",
    "critical data loss",
    "complete network outages"
  ],
  "emergency_routing_rules": {
    "primary_contact": "555-010225",
    "secondary_contacts": [
      "555-010224"
    ],
    "fallback_protocol": "Attempt transfer to 555-010225, backup 555-010226. If transfer fails assure callback within 30 minutes"
  },
  "non_emergency_routing_rules": {
    "primary_contact": "555-010224",
    "secondary_contacts": [],
    "message_protocol": "If no one answers we take messages and call back within 2 hours"
  },
  "call_transfer_rules": {
    "timeout_seconds": 30,
    "max_retries": 3,
    "failure_message": "I'm unable to connect you right now, but I'll make sure someone gets your message and calls you back as soon as possible."
  },
  "integration_constraints": [
    "We never schedule jobs without customer confirmation",
    "Server downtime and network outages are always emergencies",
    "New constraints: Never schedule jobs on Sundays",
    "Never promise remote support as the only option, always offer to schedule an on-site visit",
    "Server downtime and complete network outages always qualify"
  ],
  "after_hours_flow_summary": "After-hours: screen for emergencies",
  "office_hours_flow_summary": "Greet caller, identify needs, collect name and callback number, route to appropriate contact or take message.",
  "questions_or_unknowns": [
    "Non-emergency contact phone number not provided",
    "Company name could not be extracted",
    "Emergency definition not specified"
  ],
  "notes": "Rule-based extraction \u2014 2026-03-04T14:11:23.330354",
  "version": "v2",
  "last_updated": "2026-03-04T14:11:23.910285"
}