{
  "account_id": "ACC_001",
  "company_name": "Ben's Electric Solutions",
  "business_hours": {
    "days": [
      "Monday",
      "Tuesday",
      "Wednesday",
      "Thursday",
      "Friday"
    ],
    "start_time": "07:00",
    "end_time": "17:00",
    "timezone": "MST"
  },
  "office_address": "4710 17 Ave SW, Calgary, AB T3E 0E4",
  "services_supported": [
    "residential service calls",
    "commercial projects",
    "panel upgrades",
    "new installations",
    "EV charger setup",
    "Smart Panel Installation"
  ],
  "emergency_definition": [
    "complete power outages affecting the whole property",
    "sparking or burning electrical panels",
    "electrical fires or smoke from outlets",
    "downed power lines on property",
    "complete power outage affecting whole property",
    "electrical fire or smoke from outlets",
    "carbon monoxide alarm triggered by electrical fault"
  ],
  "emergency_routing_rules": {
    "primary_contact": "403-870-8494",
    "secondary_contacts": [
      "403-555-0199"
    ],
    "fallback_protocol": "attempt transfer to primary, then secondary, apologize and assure callback within 15 minutes if transfer fails"
  },
  "non_emergency_routing_rules": {
    "primary_contact": "403-870-8494",
    "secondary_contacts": [],
    "message_protocol": "call back within 2 hours if nobody answers",
    "during_business_hours": "route to primary contact, take detailed message if no answer"
  },
  "call_transfer_rules": {
    "timeout_seconds": 30,
    "max_retries": 3,
    "failure_message": "I'm unable to connect you right now, but I'll make sure someone gets your message and calls you back as soon as possible."
  },
  "integration_constraints": [
    "do not schedule jobs without customer confirmation",
    "do not take on jobs outside Calgary and surrounding areas within 50 kilometers",
    "Never create a job in Jobber without customer verbal confirmation",
    "Never book emergency jobs directly",
    "Never promise same-day service"
  ],
  "after_hours_flow_summary": "screen for emergency, collect information and attempt transfer to primary or secondary contact, or collect information and confirm callback next business day for non-emergencies",
  "office_hours_flow_summary": "route non-emergency calls to primary contact, take detailed message if no answer",
  "questions_or_unknowns": [
    "Account ID not provided",
    "Failure message for call transfer not specified"
  ],
  "notes": "Extracted from demo call transcript",
  "version": "v2",
  "last_updated": "2026-03-05T00:11:35.242465"
}